{
  "schema": "specmetry.check-run/v1",
  "worktree_id": "01J9Z3K5Q8R2T4V6W8X0Y2Z4D1",
  "is_target_snapshot": true,
  "isolation": "off",
  "runs": [
    {
      "criterion": "AC-004-1",
      "criterion_revision": 1,
      "evidence_id": "01J9Z3K5Q8R2T4V6W8X0Y2Z4E1",
      "seq": 701,
      "result": "pass",
      "failure_kind": null,
      "exit_code": 0,
      "duration_ms": 2210,
      "head_start": "8f3c2a1b9d7e6f5a4b3c2d1e0f9a8b7c6d5e4f3a",
      "tree_state_start": "clean",
      "evidence_grade": "observed",
      "qualifying": true
    },
    {
      "criterion": "AC-004-2",
      "criterion_revision": 1,
      "evidence_id": "01J9Z3K5Q8R2T4V6W8X0Y2Z4E2",
      "seq": 702,
      "result": "pass",
      "failure_kind": null,
      "exit_code": 0,
      "duration_ms": 1840,
      "head_start": "8f3c2a1b9d7e6f5a4b3c2d1e0f9a8b7c6d5e4f3a",
      "tree_state_start": "dirty",
      "evidence_grade": "observed",
      "qualifying": false
    },
    {
      "criterion": "AC-004-3",
      "criterion_revision": 2,
      "evidence_id": "01J9Z3K5Q8R2T4V6W8X0Y2Z4E3",
      "seq": 703,
      "result": "fail",
      "failure_kind": "nonzero_exit",
      "exit_code": 1,
      "duration_ms": 5120,
      "head_start": "8f3c2a1b9d7e6f5a4b3c2d1e0f9a8b7c6d5e4f3a",
      "tree_state_start": "clean",
      "evidence_grade": "observed",
      "qualifying": true
    },
    {
      "criterion": "AC-004-4",
      "criterion_revision": 1,
      "evidence_id": "01J9Z3K5Q8R2T4V6W8X0Y2Z4E4",
      "seq": 704,
      "result": "fail",
      "failure_kind": "nonzero_exit",
      "exit_code": null,
      "duration_ms": 730,
      "head_start": "8f3c2a1b9d7e6f5a4b3c2d1e0f9a8b7c6d5e4f3a",
      "tree_state_start": "clean",
      "evidence_grade": "observed",
      "qualifying": true
    },
    {
      "criterion": "AC-005-1",
      "criterion_revision": 1,
      "evidence_id": "01J9Z3K5Q8R2T4V6W8X0Y2Z4E5",
      "seq": 705,
      "result": "error",
      "failure_kind": "spawn_error",
      "exit_code": null,
      "duration_ms": 0,
      "head_start": "8f3c2a1b9d7e6f5a4b3c2d1e0f9a8b7c6d5e4f3a",
      "tree_state_start": "clean",
      "evidence_grade": "observed",
      "qualifying": true
    },
    {
      "criterion": "AC-005-2",
      "criterion_revision": 1,
      "evidence_id": "01J9Z3K5Q8R2T4V6W8X0Y2Z4E6",
      "seq": 706,
      "result": "error",
      "failure_kind": "input_missing",
      "exit_code": null,
      "duration_ms": 0,
      "head_start": "8f3c2a1b9d7e6f5a4b3c2d1e0f9a8b7c6d5e4f3a",
      "tree_state_start": "clean",
      "evidence_grade": "observed",
      "qualifying": true
    },
    {
      "criterion": "AC-005-3",
      "criterion_revision": 1,
      "evidence_id": "01J9Z3K5Q8R2T4V6W8X0Y2Z4E7",
      "seq": 707,
      "result": "error",
      "failure_kind": "context_changed",
      "exit_code": 0,
      "duration_ms": 3305,
      "head_start": "8f3c2a1b9d7e6f5a4b3c2d1e0f9a8b7c6d5e4f3a",
      "tree_state_start": "clean",
      "evidence_grade": "observed",
      "qualifying": false
    },
    {
      "criterion": "AC-005-4",
      "criterion_revision": 1,
      "evidence_id": "01J9Z3K5Q8R2T4V6W8X0Y2Z4E8",
      "seq": 708,
      "result": "error",
      "failure_kind": "context_changed",
      "exit_code": null,
      "duration_ms": 300000,
      "head_start": "8f3c2a1b9d7e6f5a4b3c2d1e0f9a8b7c6d5e4f3a",
      "tree_state_start": "clean",
      "evidence_grade": "observed",
      "qualifying": false
    }
  ]
}
